{
  "authority": {
    "allocationDigest": "1b92d727c0ba3272f0a992330c9b2d814aa43e94eca2034a6c58794de0aadefa",
    "appBaseHead": "4c29f9781856526e6eb94a6cf357911497bb4c1f",
    "appBaseTree": "ed081e7349e1577546c68b7bd7414d39a454df5f",
    "contextDigest": "053ccf31cd3829f448228cad922cef94264a6443a487c2a3521e6cf667f6e12c",
    "coordinationHead": "e0b470a3ca730b288695553ff7a2d2f129de7e63",
    "pathFenceDigest": "beae3b22cda76516c6a32e18186c11e442cde537e6d013e746ebe476fc3e5a32",
    "sequence": 502
  },
  "cardID": "V23-P04-C27",
  "contracts": {
    "affectedConsumerGraph": {
      "contract": "AffectedConsumerGraphV1",
      "edges": [
        {"consumers":["ALL_RENDERERS"],"source":"DESIGN_TOKENS"},
        {"consumers":["ALL_RENDERERS"],"source":"SHARED_COMPONENTS"},
        {"consumers":["ALL_PUBLIC_COPY","REPORTS","SUPPORT_EXPORT"],"source":"BRAND_VOCABULARY"},
        {"consumers":["NAVIGATION","RESTORATION","PRIVATE_DISCOVERY"],"source":"ROUTE_REGISTRY"},
        {"consumers":["VOICEOVER","VOICE_CONTROL","UI_TESTS"],"source":"SEMANTIC_IDENTITIES"},
        {"consumers":["BACKUP","RESTORE","DELETE","REPORT","SEARCH"],"source":"TECHNICAL_IDENTITIES"}
      ],
      "ordering": "SOURCE_THEN_CONSUMER_ASCENDING",
      "unknownConsumerDisposition": "FAIL_CLOSED"
    },
    "appIconReleaseManifest": {
      "appearances": [
        {"appearance":"CLEAR_DARK","disposition":"NOT_PRODUCED"},
        {"appearance":"CLEAR_LIGHT","disposition":"NOT_PRODUCED"},
        {"appearance":"DARK","disposition":"NOT_PRODUCED"},
        {"appearance":"DEFAULT","disposition":"NOT_PRODUCED"},
        {"appearance":"TINTED_DARK","disposition":"NOT_PRODUCED"},
        {"appearance":"TINTED_LIGHT","disposition":"NOT_PRODUCED"}
      ],
      "appStoreArtwork1024": "NOT_PRODUCED",
      "blockingFindings": ["APP_ICON_BUILD_SETTING_AND_SOURCE_NOT_PRESENT_AT_ACCEPTED_TREE"],
      "contract": "AppIconReleaseManifestV1",
      "iconComposerDisposition": "NOT_USED",
      "selectedBuildSetting": null,
      "selectedSourcePath": null
    },
    "applicationStateInventory": {
      "accessibilityVariants": ["AX1","AX2","AX3","AX4","AX5","DARK","HIGH_CONTRAST","REDUCE_MOTION","RTL","SWITCH_CONTROL","VOICE_CONTROL","VOICEOVER"],
      "commonStates": ["BACKGROUND_COVER","CANCELLATION","DESTRUCTIVE_CONFIRMATION","DISABLED","EMPTY","ERROR_RETRY","INTERRUPTION","KEYBOARD_FOCUS","LOADING_PROGRESS","OFFLINE","PERMISSION_DENIED","PROTECTED_DATA_LOCKED","RESTORATION","SAVE_COMMIT","STALE_ASYNC_COMPLETION","STORAGE_PRESSURE","SUCCESS","WARNING"],
      "contract": "ApplicationStateInventoryV1",
      "evidenceRecipes": ["SYNTHETIC_UNIT","SYNTHETIC_UI","STATIC_SOURCE_DIGEST","TARGETED_ACCESSIBILITY","TARGETED_INTERRUPTION","TARGETED_RECOVERY"],
      "regionOwnership": ["APP_OWNED_BASELINE","MIXED_MASKED","SYSTEM_SEMANTIC_ONLY"],
      "rendererOwners": [
        {"path":"FieldEvidenceApp/App/FieldEvidenceAppApp.swift","renderers":["StartupRootView","ReadyAppView","MaintenanceRestoreHost","EraseCleanupPendingView"]},
        {"path":"FieldEvidenceApp/App/LaunchView.swift","renderers":["LaunchView"]},
        {"path":"FieldEvidenceApp/DesignSystem/WorklightComponents.swift","renderers":["WorklightStatusBadge"]},
        {"path":"FieldEvidenceApp/Features/AssetImport/EntityIdentityResolutionView.swift","renderers":["EntityIdentityResolutionView"]},
        {"path":"FieldEvidenceApp/Features/AssetImport/ImportBulkPreviewView.swift","renderers":["ImportBulkPreviewView"]},
        {"path":"FieldEvidenceApp/Features/Backup/BackupRestoreProgressView.swift","renderers":["BackupRestoreProgressView"]},
        {"path":"FieldEvidenceApp/Features/Backup/BackupValidationSummaryView.swift","renderers":["BackupValidationSummaryView"]},
        {"path":"FieldEvidenceApp/Features/CheckRunner/CaptureStepView.swift","renderers":["CaptureStepView"]},
        {"path":"FieldEvidenceApp/Features/CheckRunner/EvidenceCurationView.swift","renderers":["EvidenceCurationView"]},
        {"path":"FieldEvidenceApp/Features/CheckRunner/EvidenceQualityCoachView.swift","renderers":["EvidenceQualityCoachView"]},
        {"path":"FieldEvidenceApp/Features/CheckRunner/FastSurveyInboxView.swift","renderers":["FastSurveyInboxView"]},
        {"path":"FieldEvidenceApp/Features/CheckRunner/IlluminatedSignPlaybookView.swift","renderers":["IlluminatedSignPlaybookView"]},
        {"path":"FieldEvidenceApp/Features/CheckRunner/OutcomeReviewView.swift","renderers":["OutcomeReviewView"]},
        {"path":"FieldEvidenceApp/Features/CheckRunner/PreflightView.swift","renderers":["PreflightView"]},
        {"path":"FieldEvidenceApp/Features/CheckRunner/ReinspectionPlanView.swift","renderers":["ReinspectionPlanView"]},
        {"path":"FieldEvidenceApp/Features/CheckRunner/ValueReceiptView.swift","renderers":["ValueReceiptView"]},
        {"path":"FieldEvidenceApp/Features/Dashboard/ExceptionReviewQueueView.swift","renderers":["ExceptionReviewQueueView"]},
        {"path":"FieldEvidenceApp/Features/Dashboard/OperationsDashboardView.swift","renderers":["OperationsDashboardView"]},
        {"path":"FieldEvidenceApp/Features/Issues/IssueDetailView.swift","renderers":["IssueDetailView"]},
        {"path":"FieldEvidenceApp/Features/Issues/RecordWorkView.swift","renderers":["RecordWorkView"]},
        {"path":"FieldEvidenceApp/Features/Recovery/RecoveryCenterView.swift","renderers":["RecoveryCenterView"]},
        {"path":"FieldEvidenceApp/Features/Reporting/ShopProfileOpenEvidenceHandoffView.swift","renderers":["ShopProfileOpenEvidenceHandoffView"]},
        {"path":"FieldEvidenceApp/Features/Reports/ReportCorrectionView.swift","renderers":["ReportCorrectionView"]},
        {"path":"FieldEvidenceApp/Features/Reports/ReportDetailView.swift","renderers":["ReportDetailView"]},
        {"path":"FieldEvidenceApp/Features/Reports/ReportFailureView.swift","renderers":["ReportFailureView"]},
        {"path":"FieldEvidenceApp/Features/Reports/ReportsRootView.swift","renderers":["ReportsRootView","SignReportHistoryView","ReportVisitList","ReportVisitFact","ReportHistoryDetailDestination","ReportComparisonView","ReportHistoryUnavailableView"]},
        {"path":"FieldEvidenceApp/Features/Rounds/OfflineReadinessPreflightView.swift","renderers":["OfflineReadinessPreflightView"]},
        {"path":"FieldEvidenceApp/Features/Rounds/RoundSessionView.swift","renderers":["RoundSessionView"]},
        {"path":"FieldEvidenceApp/Features/Sample/PackSampleView.swift","renderers":["PackSampleView","SampleValue","SampleRegistryRow"]},
        {"path":"FieldEvidenceApp/Features/Settings/BackupExportView.swift","renderers":["BackupExportView"]},
        {"path":"FieldEvidenceApp/Features/Settings/DiagnosticExportView.swift","renderers":["DiagnosticExportView"]},
        {"path":"FieldEvidenceApp/Features/Settings/EraseAllView.swift","renderers":["EraseAllView"]},
        {"path":"FieldEvidenceApp/Features/Settings/FeedbackView.swift","renderers":["FeedbackView"]},
        {"path":"FieldEvidenceApp/Features/Settings/PrivateSystemDiscoverySettingsView.swift","renderers":["PrivateSystemDiscoverySettingsView"]},
        {"path":"FieldEvidenceApp/Features/Shell/AppShellView.swift","renderers":["AppShellView","SettingsPlaceholderView","PackUnavailableView"]},
        {"path":"FieldEvidenceApp/Features/Shell/StartupMaintenanceView.swift","renderers":["StartupMaintenanceView"]},
        {"path":"FieldEvidenceApp/Features/Signs/NewSignView.swift","renderers":["NewSignView"]},
        {"path":"FieldEvidenceApp/Features/Signs/SignDetailView.swift","renderers":["SignDetailView"]},
        {"path":"FieldEvidenceApp/Features/Signs/SignsRootView.swift","renderers":["SignsRootView"]},
        {"path":"FieldEvidenceApp/Features/Subscription/PaywallView.swift","renderers":["PaywallView"]},
        {"path":"FieldEvidenceApp/Features/Subscription/SubscriptionStatusView.swift","renderers":["SubscriptionStatusView"]}
      ],
      "roots": ["ASSETS","REPORTS","TODAY","WORK"],
      "runtimeProfiles": ["MINIMUM_IOS_18","LATEST_ACCEPTED_STABLE_SHIPPING_RUNTIME"],
      "unknownOwnerDisposition": "FAIL_CLOSED"
    },
    "brandHIGStateInventory": {
      "acceptedS10ExceptionDisposition": "PRESERVE_ACCEPTED_AND_RECOMPUTE_AFFECTED_ONLY",
      "contract": "BrandHIGStateInventoryContractV1",
      "higTaxonomy": {
        "datedAt": "2026-08-22",
        "deferredOutsideV21": 6,
        "leafCount": 157,
        "nodeCount": 171,
        "notApplicableWithRationale": 76,
        "platformHandled": 10,
        "applicable": 65,
        "sourcePath": "docs/design/v23/EXPANSION_V23_FOUNDATION_PLAN.md",
        "sourceSHA256": "f7d4ac03f066d85771526c195152ab6e17c32c2a9dee98248c3bfa8813456980"
      },
      "lifecycle": "NONPERSISTENT",
      "unknownDisposition": "FAIL_CLOSED"
    },
    "brandPrePolishFreezeReceipt": {
      "acceptedHead": "4c29f9781856526e6eb94a6cf357911497bb4c1f",
      "acceptedTree": "ed081e7349e1577546c68b7bd7414d39a454df5f",
      "automaticBaselineUpdate": false,
      "contract": "BrandPrePolishFreezeReceiptV1",
      "freezeDisposition": "PRE_POLISH_INVENTORY_ONLY",
      "inFlightExceptionCountFrozen": false,
      "reentryTriggers": ["AUDIT_SIGNATURE","COLOR","DEVICE_RUNTIME","DYNAMIC_TYPE","GEOMETRY","LOCALE","RENDERER","SEMANTIC_IDENTITY","TEXT"]
    },
    "brandVocabularyMap": {
      "advancedTechnicalDiagnostics": ["FieldEvidenceData","FieldEvidenceOperations","FieldEvidenceRestore","com.palatis3.fieldrecordbackup","fieldrecordbackup"],
      "contract": "BrandVocabularyMapV1",
      "genericShell": ["asset","evidence","report","work","workspace"],
      "packageVocabulary": {"LIGHTING":["lighting","luminaire"],"SIGNS":["sign"],"SURVEYS":["survey"]},
      "practice": "Practice",
      "product": "AssetRounds",
      "residuePolicy": "ZERO_UNALLOWLISTED_VISIBLE_FIELD_EVIDENCE",
      "technicalDiagnosticsDefaultExported": false
    },
    "technicalIdentityFreeze": {
      "backupExtension": "fieldrecordbackup",